<partsCatalog 
  xmlns="http://www.ManufacturingUnlimited.co.za/partsCatalog"
  xmlns:xsi="http://www.w3.org/2001/XMLSchema-instance"
  xsi:schemaLocation="http://www.ManufacturingUnlimited.co.za/partsCatalog 
                                   partsCatalog.xsd">

  <part code="PC103">
    <name>Pentium Flyer</name>
    <description>Pentium III based PC</description>
    <assemblyInstruction>
      Plug keyboard cable into green socket.
    </assemblyInstruction>
    <assemblyInstruction>
      Plug rat (mouse) cable into purple socket.
    </assemblyInstruction>
    <assemblyInstruction>
      Plug screen cable into whatever hole it fits in.
    </assemblyInstruction>

    <part code="kbd03">
      <name>keyboard</name>
    </part>

    <part code="rat12">
      <name>rat</name>
      <manufacturer>Log002</manufacturer>
    </part>

    <part code="scr001">
      <name>screen</name>
    </part>

    <part>
      <name>processingBox</name>
      <part code="MB121">
        <name>motherboard</name>
        <part code="PIII-800">
          <name>CPU</name>
        </part>
      </part>
    </part>
  </part>

  <part xsi:type="Product">
    <name>Crunch-It</name>
    <description>The number crunching monster.</description>
    <part>
      <name>Cube processor array</name>
    </part>
    <price>
      <amount>33223.98</amount>
      <currency>ZAR</currency>
    </price>
  </part>

  <manufacturer id="Log002">
    <name>Logitech</name>
    <address>13 Cyber Street, Silicon Hill</address>
    <part>rat12</part>
    <part>MB121</part>
  </manufacturer>

</partsCatalog>
